{
  "$schema": "../schema.json",
  "version": 1,
  "name": "VGM",
  "updatedAt": "2026-10-17T19:27:53.586Z",
  "maps": [
    {
      "id": "vgm-1-5x-lager-field-for-up-to-7x7-teams",
      "name": "1.5x lager field for up to 7x7 teams",
      "author": "Stanbroek",
      "summary": "A 1.5x enlarged version of Simplicity v4.0 for up to 7 vs 7 in Rocket League.",
      "description": "A 1.5x enlarged version of Simplicity v4.0 for up to 7 vs 7 in Rocket League.",
      "tags": [
        "Arena",
        "Training"
      ],
      "thumbnail": "https://uploads.videogamemods.com/communities/vgm/mods/1-5x-lager-field-for-up-to-7x7-teams-e713a0df-8f40-4467-be14-7808576d850c/images/0_647c1866.webp",
      "homepage": "https://videogamemods.com/vgm/rocketleague/mods/1-5x-lager-field-for-up-to-7x7-teams",
      "source": "vgm",
      "version": "v1.0.0",
      "download": {
        "url": "https://uploads.videogamemods.com/communities/vgm/mods/1-5x-lager-field-for-up-to-7x7-teams-e713a0df-8f40-4467-be14-7808576d850c/files/1527858809_EnlargedMap.zip",
        "filename": "1527858809_EnlargedMap.zip",
        "size": 1679807
      },
      "imports": [
        "Engine",
        "EngineMaterials",
        "EngineResources",
        "Engine_MI_Shaders",
        "Park_P",
        "enginedebugmaterials",
        "tagame"
      ]
    },
    {
      "id": "vgm-air-training",
      "name": "Air training",
      "author": "Zuckra",
      "summary": "Air trining",
      "description": "Air trining",
      "tags": [
        "Arena",
        "Training"
      ],
      "thumbnail": null,
      "homepage": "https://videogamemods.com/vgm/rocketleague/mods/air-training",
      "source": "vgm",
      "version": "v1",
      "download": {
        "url": "https://uploads.videogamemods.com/communities/vgm/mods/air-training-e08ac172-3417-49be-a18e-b93a478926d6/files/1605037812_814164094_aerial_training-2.zip",
        "filename": "1605037812_814164094_aerial_training-2.zip",
        "size": 22361607
      },
      "imports": [
        "Engine",
        "EngineMaterials",
        "enginedebugmaterials"
      ]
    },
    {
      "id": "vgm-ascension-map",
      "name": "Ascension [Map]",
      "author": "TroJan_virus",
      "summary": "Sorry my PC died when I was originally working on this and never got it to a playable state. I guess I can keep it here for reference to what I wanted to achiev",
      "description": "Sorry my PC died when I was originally working on this and never got it to a playable state. I guess I can keep it here for reference to what I wanted to achieve. A multi-level battle arena. I'm sure it has been done by now though.",
      "tags": [
        "Arena"
      ],
      "thumbnail": "https://uploads.videogamemods.com/communities/vgm/mods/ascension-map-66c51c80-47b0-456c-9e1b-0892ff82934e/images/1_3bccde60.webp",
      "homepage": "https://videogamemods.com/vgm/rocketleague/mods/ascension-map",
      "source": "vgm",
      "version": "v0.2",
      "download": {
        "url": "https://uploads.videogamemods.com/communities/vgm/mods/ascension-map-66c51c80-47b0-456c-9e1b-0892ff82934e/files/1473156395_AscensionV0.2.zip",
        "filename": "1473156395_AscensionV0.2.zip",
        "size": 2232986
      },
      "imports": [
        "ASC_Base",
        "Engine",
        "EngineMaterials",
        "EngineVolumetrics",
        "HU_Base",
        "LT_Floors",
        "MapTemplates",
        "TestPackage",
        "UN_DetailTex",
        "UN_Liquid"
      ]
    },
    {
      "id": "vgm-obstacle-course-2",
      "name": "Obstacle Course #2",
      "author": "frenchfries",
      "summary": "A series of challenges  (8 levels) of increasing difficulty, some parts like cs go surfing.",
      "description": "A series of challenges  (8 levels) of increasing difficulty, some parts like cs go surfing.\n\nBy French Fries",
      "tags": [
        "Race",
        "Training"
      ],
      "thumbnail": "https://uploads.videogamemods.com/communities/vgm/mods/obstacle-course-2-623d384c-72ef-4693-ab62-1181b8540e28/images/0_49c43044.webp",
      "homepage": "https://videogamemods.com/vgm/rocketleague/mods/obstacle-course-2",
      "source": "vgm",
      "version": "v1.0",
      "download": {
        "url": "https://uploads.videogamemods.com/communities/vgm/mods/obstacle-course-2-623d384c-72ef-4693-ab62-1181b8540e28/files/1480081731_ObstacleCourse2.zip",
        "filename": "1480081731_ObstacleCourse2.zip",
        "size": 37933649
      },
      "imports": [
        "Engine",
        "EngineMaterials",
        "EngineMeshes",
        "MyPackage",
        "enginedebugmaterials"
      ]
    },
    {
      "id": "vgm-parcar-nb",
      "name": "Parcar-NB",
      "author": "neutrinobeam",
      "summary": "A parkour style map with integrated timer and checkpoints. Land on each of the ten platforms in turn.",
      "description": "A parkour style map with integrated timer and checkpoints. Land on each of the ten platforms in turn.\n\nPlay in Free Play under Training Mode.\nThe timer starts when you leave the first platform and stops when you land on the final.\nNo skipping platforms; you will be sent back.\nResetting will place you on the last attained platform and point you at the next.",
      "tags": [],
      "thumbnail": "https://uploads.videogamemods.com/communities/vgm/mods/parcar-nb-c1a08c1d-23df-4e76-a0d7-38265718b635/images/0_1719f737.webp",
      "homepage": "https://videogamemods.com/vgm/rocketleague/mods/parcar-nb",
      "source": "vgm",
      "version": "v1.1",
      "download": {
        "url": "https://uploads.videogamemods.com/communities/vgm/mods/parcar-nb-c1a08c1d-23df-4e76-a0d7-38265718b635/files/1471489716_Parcar-NB1.zip",
        "filename": "1471489716_Parcar-NB1.zip",
        "size": 95753
      },
      "imports": [
        "Engine",
        "EngineMaterials",
        "enginedebugmaterials"
      ]
    },
    {
      "id": "vgm-parcour-map-v0-65",
      "name": "Parcour-Map V0.65",
      "author": "dreal",
      "summary": "An Parcour-training map with not so many parcours yet ?",
      "description": "An Parcour-training map with not so many parcours yet ?\n\nWork in Progress: Goal is 20 Parcours at the Moment - 13 done.\n\nIt's my Playground to try new Ideas for Maps and mechanics for making new interesting Maps ? \n\nSo give me Feedback! ;)",
      "tags": [
        "Training"
      ],
      "thumbnail": "https://uploads.videogamemods.com/communities/vgm/mods/parcour-map-v0-65-e6d01906-5961-4668-8dcc-1f152c06fb88/images/2_1c2fe74e.webp",
      "homepage": "https://videogamemods.com/vgm/rocketleague/mods/parcour-map-v0-65",
      "source": "vgm",
      "version": "v0.65",
      "download": {
        "url": "https://uploads.videogamemods.com/communities/vgm/mods/parcour-map-v0-65-e6d01906-5961-4668-8dcc-1f152c06fb88/files/1473364281_Parcour_v0.55.zip",
        "filename": "1473364281_Parcour_v0.55.zip",
        "size": 8082207
      },
      "imports": [
        "EditorLandscapeResources",
        "Engine",
        "Engine_MI_Shaders",
        "Envy_Effects",
        "KismetGame_Assets",
        "WP_Enforcers",
        "enginedebugmaterials",
        "tagame"
      ]
    },
    {
      "id": "vgm-pirate-ship-map",
      "name": "Pirate Ship Map",
      "author": "coco1359",
      "summary": "Pirate ship map made by myself, hope you enjoy it",
      "description": "Pirate ship map made by myself, hope you enjoy it",
      "tags": [],
      "thumbnail": "https://uploads.videogamemods.com/communities/vgm/mods/pirate-ship-map-9ee1abe4-de67-45ea-b125-2324cc1b08a4/images/0_62e9e42a.webp",
      "homepage": "https://videogamemods.com/vgm/rocketleague/mods/pirate-ship-map",
      "source": "vgm",
      "version": "v1",
      "download": {
        "url": "https://uploads.videogamemods.com/communities/vgm/mods/pirate-ship-map-9ee1abe4-de67-45ea-b125-2324cc1b08a4/files/1471430335_Pirate_Ship_ByCoCo.zip",
        "filename": "1471430335_Pirate_Ship_ByCoCo.zip",
        "size": 44912809
      },
      "imports": [
        "EditorMeshes",
        "Engine",
        "EngineMaterials",
        "tagame"
      ]
    },
    {
      "id": "vgm-proving-grounds",
      "name": "Proving Grounds",
      "author": "karlheinzschneid",
      "summary": "Training Map - similar size as rl normal maps - with built in fully customizeable ball cannon and target shooting with random target positions",
      "description": "Training Map - similar size as rl normal maps - with built in fully customizeable ball cannon and target shooting with random target positions\n\nthe map is built with multiplayer in mind, so following versions will be optimized for MP (though allready roughly working)\n\nNOTE: this is Beta 1, so not everything is working 100%. for controlls and how to use it see https://www.youtube.com/watch?v=GfovqqYTKK8\n\nPlease report bugs and post feedback so i can improve the map!\n\nPS: i'm looking for a skilled 3d artist for this and other RL mods, hit me up a reddit /u/KarlHeinz_Schneider/ or in the RL modding discord!\n\nPPS: for fellow RL moders: _for now_ i made the kismet not so easily readable, but i'm planing to release advanced kismet guides on different topics (make suggestions!) in  the next weeks, and for information you can ask me on reddit/discord.\n\n \n\nKnown Bugs:\n\nyou sometimes fall of the wall with high speed -> need better 3d models\nball canon is moveable out of bounds of the arena\nUI Text (kismet -> draw text) not correctly displayed at custom resolution (at least not 1080p). Thanks to /u/KabelGuy for reporting!\n\nPlanned features for following versions: \n\nbug fixes\nprettier UI with better handling\nbetter 3d models with custom textures\nbetter camera handling\nmore and different shooting szenarios\n(maybe) support for Rocket League Trainer and training share/import\nand many more!",
      "tags": [],